{"proposal_id":"proposal-2026-07-22-001","proposed_by":"project-historian","proposed_date":"2026-07-22","status":"proposed","lifecycle":"generated","title":"Add a new tracked product","context":"A new capture product meets the watchlist entry threshold.","decision":"Add the product to the monitored watchlist.","alternatives":["Monitor informally without adding it","Wait for an API announcement"],"consequences":"The analyst will collect baseline data during future runs.","sources":[{"url":"https://example.com/product","title":"Product announcement","access_date":"2026-07-22","claim_type":"vendor-claim","author":null,"publication":"Example Vendor"}],"related_issue":null}
